{
  "$schema": "./release-plan.schema.json",
  "name": "release(oss): publish Proofline UI/UX upgrade across all channels",
  "status": "verified",
  "releaseOwner": "AuraOne Open maintainers",
  "rollbackOwner": "AuraOne Open maintainers",
  "destinationInventory": "release/offering-destinations.json",
  "publicationDecision": "release/evidence/publication-decision.json",
  "publicationAuthorization": "release/publication-authorization.json",
  "targetDate": "2026-07-12",
  "program": "Proofline OSS UI/UX upgrade",
  "qualityEvidenceClaims": [
    {
      "name": "version",
      "commands": ["npm run versions:verify"]
    },
    {
      "name": "changelog",
      "commands": ["npm run versions:verify"]
    },
    {
      "name": "marketing and discovery metadata",
      "commands": [
        "npm run marketing:verify",
        "pnpm --dir auraone-website run test:capture:oss",
        "pnpm --dir auraone-website exec vitest run tests/buying-toolkit.test.ts tests/site-route-inventory.contract.test.ts tests/open-docs-slice-contract.test.ts tests/open-route-discovery-metadata.contract.test.ts"
      ]
    },
    {
      "name": "tests",
      "commands": [
        "cd packages/evalkit && python -m pytest -p no:cacheprovider -q tests",
        "cd robotics-reviewkit && python -m pytest -p no:cacheprovider -q tests",
        "cd robotics-reviewkit/viewer/reviewkit-v2 && npm run check",
        "npm test",
        "python -m pytest -p no:cacheprovider -q",
        "npm run release:preflight",
        "pnpm --dir opensource/open-studio-platform/packages/proofline-oss test",
        "pnpm --dir opensource/open-studio-platform/packages/aura-ide-kit test",
        "pnpm --dir opensource/rubric-studio-open test:product",
        "pnpm --dir opensource/rubric-studio-open tauri:core:test",
        "pnpm --dir opensource/agent-studio-open test",
        "pnpm --dir opensource/agent-studio-open test:a11y",
        "pnpm --dir opensource/agent-studio-open desktop:check",
        "cd opensource/agent-studio-open/cli && python -m pytest -p no:cacheprovider -q",
        "pnpm --dir opensource/robotics-studio test",
        "pnpm --dir opensource/robotics-studio test:browser",
        "pnpm --dir opensource/robotics-studio rust:test",
        "pnpm --dir opensource/evalkit-playground test",
        "cd opensource/failure-gallery && python -m pytest -p no:cacheprovider -q",
        "cd opensource/failure-gallery && PYTHONPATH=src python -m failure_gallery.cli check cases/",
        "cd opensource/evalkit-action && npm ci && npm run release:preflight -- v0.2.0",
        "cd opensource/datasheet-ci && npm ci && node scripts/release-preflight.mjs v0.2.0",
        "cd opensource/datasheet-ci/python_validator && python -m pytest -p no:cacheprovider -q && python -m build && python -m twine check dist/* && python scripts/release_preflight.py --dist dist",
        "cd opensource/rubric-pr-bot && npm ci && npm run release:preflight -- v0.2.0",
        "cd opensource/robotics-reviewkit && python -m pytest -p no:cacheprovider -q tests",
        "cd opensource/robotics-reviewkit/viewer/reviewkit-v2 && npm ci && npm run check",
        "pnpm --dir auraone-website run test:capture:oss",
        "pnpm --dir auraone-website exec vitest run tests/buying-toolkit.test.ts tests/site-route-inventory.contract.test.ts tests/open-docs-slice-contract.test.ts tests/open-route-discovery-metadata.contract.test.ts"
      ]
    },
    {
      "name": "rendered accessibility and responsive checks",
      "commands": [
        "node opensource/rubric-studio-open/scripts/capture_screenshots.mjs --verify",
        "pnpm --dir opensource/agent-studio-open test:a11y",
        "node opensource/agent-studio-open/scripts/capture_screenshots.mjs --verify",
        "pnpm --dir opensource/robotics-studio test:browser",
        "node opensource/robotics-studio/scripts/capture_screenshots.mjs --verify",
        "cd robotics-reviewkit/viewer/reviewkit-v2 && npm run check",
        "cd opensource/robotics-reviewkit/viewer/reviewkit-v2 && npm ci && npm run check",
        "pnpm --dir auraone-website run test:capture:oss"
      ]
    },
    {
      "name": "reduced-motion, forced-colors, and print checks",
      "commands": [
        "cd packages/evalkit && python -m pytest -p no:cacheprovider -q tests",
        "pnpm --dir opensource/agent-studio-open test:a11y",
        "pnpm --dir opensource/robotics-studio test",
        "pnpm --dir opensource/robotics-studio test:browser",
        "pnpm --dir auraone-website run test:capture:oss"
      ]
    },
    {
      "name": "package contents",
      "commands": [
        "cd packages/evalkit && python -m build",
        "cd packages/evalkit && python -m twine check dist/*",
        "cd packages/evalkit && python scripts/verify_release.py dist",
        "npm pack --dry-run",
        "python -m build",
        "python -m twine check dist/*",
        "python scripts/release_preflight.py --dist dist",
        "npm run release:preflight",
        "cd opensource/open-studio-platform/packages/proofline-oss && npm pack --dry-run",
        "cd opensource/open-studio-platform/packages/aura-ide-kit && npm pack --dry-run",
        "cd opensource/agent-studio-open/cli && rm -rf build dist src/*.egg-info && python -m build && python scripts/release_preflight.py --expected-version 0.2.0 --dist dist",
        "cd opensource/failure-gallery && rm -rf build dist src/*.egg-info && python -m build && python scripts/release_preflight.py --expected-version 0.2.0 --dist dist",
        "cd opensource/evalkit-action && npm ci && npm run release:preflight -- v0.2.0",
        "cd opensource/datasheet-ci && npm ci && node scripts/release-preflight.mjs v0.2.0",
        "cd opensource/datasheet-ci/python_validator && python -m pytest -p no:cacheprovider -q && python -m build && python -m twine check dist/* && python scripts/release_preflight.py --dist dist",
        "cd opensource/rubric-pr-bot && npm ci && npm run release:preflight -- v0.2.0",
        "pnpm --dir auraone-website run build",
        "pnpm --dir opensource/open-studio-platform release:oss:dry-run"
      ]
    }
  ],
  "repositories": [
    {
      "id": "auraone-open-public",
      "path": ".",
      "channels": ["pypi", "github-release", "hosted-reviewkit"],
      "packages": ["auraone-evalkit"],
      "releases": [
        {
          "name": "auraone-evalkit",
          "from": "0.2.1",
          "to": "0.3.0",
          "registry": "pypi",
          "reason": "minor: new report contract and backward-compatible CLI formats"
        }
      ],
      "assetRoots": ["packages/evalkit", "robotics-reviewkit"],
      "sourceRoots": ["."],
      "commands": [
        "npm run versions:verify",
        "npm run marketing:verify",
        "npm run design:lint",
        "npm run workflows:lint",
        "cd packages/evalkit && python -m pytest -p no:cacheprovider -q tests",
        "cd packages/evalkit && python -m build",
        "cd packages/evalkit && python -m twine check dist/*",
        "cd packages/evalkit && python scripts/verify_release.py dist",
        "cd robotics-reviewkit && python -m pytest -p no:cacheprovider -q tests",
        "cd robotics-reviewkit/viewer/reviewkit-v2 && npm ci",
        "cd robotics-reviewkit/viewer/reviewkit-v2 && npm run check"
      ],
      "publicationChecks": [
        "node scripts/verify-publication-controls.mjs --workflow .github/workflows/release-python.yml --registry pypi --package auraone-evalkit"
      ]
    },
    {
      "id": "auraoneai-github-app",
      "path": "../auraoneai-github-app",
      "channels": ["npm", "github-release", "github-app"],
      "packages": ["@auraone/github-app"],
      "releases": [
        {
          "name": "@auraone/github-app",
          "from": "0.1.1",
          "to": "0.2.0",
          "registry": "npm",
          "reason": "minor: Check Runs and idempotent PR evidence output"
        }
      ],
      "assetRoots": ["src", "README.md"],
      "sourceRoots": ["."],
      "commands": ["npm test", "npm run lint", "npm pack --dry-run"],
      "publicationChecks": [
        "node '../auraone-open-public/scripts/verify-publication-controls.mjs' --workflow .github/workflows/release-npm.yml --registry npm --package '@auraone/github-app'"
      ]
    },
    {
      "id": "auraoneai-sdk-python",
      "path": "../auraoneai-sdk-python",
      "channels": ["pypi", "github-release", "developer-docs"],
      "packages": ["auraone-sdk"],
      "releases": [
        {
          "name": "auraone-sdk",
          "from": "0.1.2",
          "to": "0.2.0",
          "registry": "pypi",
          "reason": "minor: structured CLI output and stable exit contract"
        }
      ],
      "assetRoots": ["aura", "aura_one", "README.md"],
      "sourceRoots": ["."],
      "commands": [
        "python -m pytest -p no:cacheprovider -q",
        "python -m build",
        "python -m twine check dist/*",
        "python scripts/release_preflight.py --dist dist"
      ],
      "publicationChecks": [
        "node '../auraone-open-public/scripts/verify-publication-controls.mjs' --workflow .github/workflows/release-python.yml --registry pypi --package auraone-sdk"
      ]
    },
    {
      "id": "auraoneai-sdk-typescript",
      "path": "../auraoneai-sdk-typescript",
      "channels": ["npm", "github-release", "developer-docs"],
      "packages": ["@auraone/sdk"],
      "releases": [
        {
          "name": "@auraone/sdk",
          "from": "0.1.5",
          "to": "0.2.0",
          "registry": "npm",
          "reason": "minor: root evaluation exports and release contract"
        }
      ],
      "assetRoots": ["src", "README.md"],
      "sourceRoots": ["."],
      "commands": ["npm run release:preflight"],
      "publicationChecks": [
        "node '../auraone-open-public/scripts/verify-publication-controls.mjs' --workflow .github/workflows/release-npm.yml --registry npm --package '@auraone/sdk'"
      ]
    },
    {